{
  "schema_version": 1,
  "site_title": "AI 日报",
  "generated_at": "2026-07-14T11:18:49.433Z",
  "latest_edition": {
    "report_date": "2026-07-09",
    "title": "AI 日报 2026-07-09",
    "summary": "今日主线：OpenAI介绍模型能力和推理入口变化；Microsoft介绍 agent 与开发者工具能力；OpenAI介绍模型评估和研究结果；技术博客补充 agent 和开发工具的落地边界。",
    "report_url": "data/2026/07/2026-07-09.json",
    "data_url": "data/2026/07/2026-07-09.json",
    "generated_at": "2026-07-09T13:04:36.709Z",
    "story_count": 8,
    "lead_story": {
      "id": "article-3fb14968493dc682",
      "title": "OpenAI介绍模型能力和推理入口变化",
      "url": "https://openai.com/index/introducing-gpt-live",
      "summary": "OpenAI梳理模型评测与能力边界，重点包括能力边界、评估设置、数据来源、使用场景和限制说明，使用前提是结论仍要依赖可复现评测、真实任务和公开限制。 可观察的是 AI 产品、模型或平台策略的实际变化",
      "event_date": "2026-07-08",
      "source": "OpenAI Company News RSS",
      "label": "本期主线",
      "tags": [
        "基础模型",
        "快讯",
        "OpenAI"
      ],
      "report_url": "data/2026/07/2026-07-09.json"
    },
    "secondary_stories": [
      {
        "id": "article-156baccb80e387dd",
        "title": "Microsoft介绍 agent 与开发者工具能力",
        "url": "https://www.microsoft.com/en-us/research/blog/flint-a-visualization-language-for-the-ai-era/",
        "summary": "微软研究院调整开发者 agent 工作流，重点包括任务编排、上下文、权限控制、工程集成和失败恢复，使用前提是实际效果要看权限模型、评估回放、团队流程和可观测性。 可观察的是代码、权重、示例、许可证和生态复用条件",
        "event_date": "2026-07-08",
        "source": "Microsoft Research Blog",
        "label": "本期主线",
        "tags": [
          "基础模型",
          "论文",
          "Microsoft"
        ],
        "report_url": "data/2026/07/2026-07-09.json"
      },
      {
        "id": "article-e9167e656930e3f1",
        "title": "OpenAI介绍模型评估和研究结果",
        "url": "https://openai.com/index/separating-signal-from-noise-coding-evaluations",
        "summary": "OpenAI给出Blackwell MLPerf 训练性能结果，重点包括训练基准、硬件吞吐、模型规模、对比设置和数据中心部署前提，使用前提是benchmark 结果仍要结合任务类型、集群配置、能耗和真实训练负载判断。 可观察的是 agent、开发工具和自动化工作流的接入成本",
        "event_date": "2026-07-08",
        "source": "OpenAI News RSS",
        "label": "本期主线",
        "tags": [
          "基础模型",
          "论文",
          "OpenAI"
        ],
        "report_url": "data/2026/07/2026-07-09.json"
      },
      {
        "id": "article-ae0ec71fdcb44d65",
        "title": "Anthropic介绍模型评估和研究结果",
        "url": "https://www.anthropic.com/research/off-switch-dual-use",
        "summary": "Anthropic梳理模型评测与能力边界，重点包括能力边界、评估设置、数据来源、使用场景和限制说明，使用前提是结论仍要依赖可复现评测、真实任务和公开限制。 可观察的是评测设置、能力边界和内部实验参照价值",
        "event_date": "2026-07-08",
        "source": "Anthropic Research",
        "label": "本期主线",
        "tags": [
          "基础模型",
          "论文",
          "Anthropic"
        ],
        "report_url": "data/2026/07/2026-07-09.json"
      }
    ],
    "compact_stories": [
      {
        "id": "article-ebb1bbaa99d3f35a",
        "title": "Alibaba Cloud介绍安全治理和平台控制变化",
        "url": "https://www.alibabacloud.com/blog/alibaba-cloud-waap-pioneers-a-new-paradigm-for-agentic-application-security-in-china_603344",
        "summary": "Alibaba Cloud调整开发者 agent 工作流，重点包括任务编排、上下文、权限控制、工程集成和失败恢复，使用前提是实际效果要看权限模型、评估回放、团队流程和可观测性。 可观察的是 agent、开发工具和自动化工作流的接入成本",
        "event_date": "2026-07-09",
        "source": "Alibaba Cloud Blog",
        "label": "本期主线",
        "tags": [
          "基础模型",
          "商业洞察",
          "Alibaba"
        ],
        "report_url": "data/2026/07/2026-07-09.json"
      },
      {
        "id": "article-e00d55023af7c16f",
        "title": "OpenAI介绍安全治理和平台控制变化",
        "url": "https://openai.com/index/government-national-security-partnerships",
        "summary": "OpenAI说明安全治理和平台控制更新，重点包括策略检查、风险控制、上线约束、审计记录和组织执行，使用前提是治理效果取决于误判率、日志留存、人工复核和系统接入范围。 可观察的是合规、安全和平台治理口径变化",
        "event_date": "2026-07-08",
        "source": "OpenAI News RSS",
        "label": "本期主线",
        "tags": [
          "企业 AI 采纳",
          "商业洞察",
          "OpenAI"
        ],
        "report_url": "data/2026/07/2026-07-09.json"
      },
      {
        "id": "article-1afe3e0c6a3aeba5",
        "title": "Alibaba Cloud介绍模型评估和研究结果",
        "url": "https://www.alibabacloud.com/blog/alibaba-cloud-emr-serverless-starrocks-lakehouse-multimodal-retrieval-one-sql-for-full-text-scalar-and-vector-hybrid-search_603345",
        "summary": "Alibaba Cloud介绍机器人学习与多模态推理实验，重点包括具身任务规划、训练数据、多模态推理和评估工作流，使用前提是研究信号仍需要看真实机器人任务、数据规模和评测设置。 可观察的是评测设置、能力边界和内部实验参照价值",
        "event_date": "2026-07-09",
        "source": "Alibaba Cloud Blog",
        "label": "本期主线",
        "tags": [
          "多模态 AI",
          "论文",
          "Alibaba"
        ],
        "report_url": "data/2026/07/2026-07-09.json"
      },
      {
        "id": "article-3447f8d32f7ed63d",
        "title": "OpenAI介绍 Claude Code agent 工具工作流",
        "url": "https://openai.com/index/k-12-educators-practical-skills",
        "summary": "OpenAI整理公开产品或工程信息，重点包括标题、适用场景、访问条件、限制说明和后续链接，使用前提是访问条件、地区范围、价格和使用限制决定可采用性。 可观察的是 AI 产品、模型或平台策略的实际变化",
        "event_date": "2026-07-08",
        "source": "OpenAI News RSS",
        "label": "本期主线",
        "tags": [
          "基础模型",
          "实战方法",
          "OpenAI"
        ],
        "report_url": "data/2026/07/2026-07-09.json"
      }
    ]
  },
  "previous_edition": {
    "report_date": "2026-07-08",
    "title": "AI 日报 2026-07-08",
    "summary": "今天的重点集中在三条线：阿尔伯塔政府用 Claude Code 大规模审查遗留系统，GitHub 扩展 Copilot 的企业使用范围，OpenAI 与腾讯继续补强智能体和开发者工具。开源榜单则显示，评测、自动化任务和工程工具仍是开发者关注的主要方向。",
    "report_url": "data/2026/07/2026-07-08.json",
    "data_url": "data/2026/07/2026-07-08.json",
    "generated_at": "2026-07-08T04:22:35.604Z",
    "story_count": 8,
    "lead_story": {
      "id": "article-33ff9177ca69de68",
      "title": "Claude Code 政府代码安全审计",
      "url": "https://www.anthropic.com/news/alberta-government-claude-cybersecurity",
      "summary": "阿尔伯塔省技术与创新部让约 50 个 Claude Code agent 并行审查 4.66 亿行政府代码，约 20 小时完成扫描；Claude Code 还参与生成修复和测试，所有上线变更仍由工程师审核批准。 这是政府遗留系统把 AI agent 用于大规模安全审计和现代化的真实案例，重点不只是发现问题，还包括可回看的证据、自动化修复与人工发布门禁。",
      "event_date": "2026-07-06",
      "source": "Anthropic News",
      "label": "本期主线",
      "tags": [
        "基础模型",
        "快讯",
        "Anthropic"
      ],
      "report_url": "data/2026/07/2026-07-08.json"
    },
    "secondary_stories": [
      {
        "id": "article-0427039daf6e1318",
        "title": "GitHub Changelog说明 Copilot 与企业可用范围变化",
        "url": "https://github.blog/changelog/2026-07-07-kimi-k2-7-now-available-for-copilot-business-and-enterprise",
        "summary": "GitHub说明模型能力和评估方法更新，重点包括能力边界、评估设置、数据来源、使用场景和限制说明，使用前提是结论仍要依赖可复现评测、真实任务和公开限制。 可观察的是代码、权重、示例、许可证和生态复用条件",
        "event_date": "2026-07-08",
        "source": "GitHub Changelog",
        "label": "本期主线",
        "tags": [
          "基础模型",
          "商业洞察",
          "GitHub"
        ],
        "report_url": "data/2026/07/2026-07-08.json"
      },
      {
        "id": "article-ab9ea62ec59ebe1a",
        "title": "OpenAI更新公开产品或工程信息",
        "url": "https://openai.com/index/australian-payments-plus",
        "summary": "OpenAI更新公开产品或工程信息，重点包括标题、适用场景、访问条件、限制说明和后续链接，使用前提是读者还要查看原文中的访问条件、地区范围、价格和使用限制。 可观察的是 agent、开发工具和自动化工作流的接入成本",
        "event_date": "2026-07-07",
        "source": "OpenAI News RSS",
        "label": "本期主线",
        "tags": [
          "企业 AI 采纳",
          "商业洞察",
          "OpenAI"
        ],
        "report_url": "data/2026/07/2026-07-08.json"
      },
      {
        "id": "article-b7195bbec0581aa4",
        "title": "OpenAI说明 agent 与开发者工具能力",
        "url": "https://openai.com/index/mufg",
        "summary": "OpenAI 继续强化面向开发者的智能体与代码工具能力，重点放在任务编排、上下文管理、权限控制和工程集成。团队评估时应结合权限模型、回放评估、现有流程和可观测性指标。 可观察的是 agent、开发工具和自动化工作流的接入成本",
        "event_date": "2026-07-07",
        "source": "OpenAI News RSS",
        "label": "本期主线",
        "tags": [
          "基础模型",
          "商业洞察",
          "OpenAI"
        ],
        "report_url": "data/2026/07/2026-07-08.json"
      }
    ],
    "compact_stories": [
      {
        "id": "article-7aa724ea24d5d2d3",
        "title": "Tencent AI Business发布 agent 与开发者工具能力",
        "url": "https://www.tencent.com/en-us/articles/2202386.html",
        "summary": "Tencent AI Business 继续推进智能体与开发者工具能力，重点放在任务编排、上下文管理、权限控制和工程集成。团队评估时应结合权限模型、回放评估、现有流程和可观测性指标。 可观察的是 agent、开发工具和自动化工作流的接入成本",
        "event_date": "2026-07-06",
        "source": "Tencent AI Business",
        "label": "本期主线",
        "tags": [
          "基础模型",
          "商业洞察",
          "Tencent"
        ],
        "report_url": "data/2026/07/2026-07-08.json"
      },
      {
        "id": "article-3d4095ac732ad8b7",
        "title": "Meta Newsroom说明 AIGC 创作工作流",
        "url": "https://about.fb.com/news/2026/07/introducing-muse-image-meta-ai/",
        "summary": "Meta Newsroom说明模型能力和评估方法更新，重点包括能力边界、评估设置、数据来源、使用场景和限制说明，使用前提是结论仍要依赖可复现评测、真实任务和公开限制。 可观察的是素材生成质量、创作者工具链成本和交付方式",
        "event_date": "2026-07-07",
        "source": "Meta Newsroom",
        "label": "本期主线",
        "tags": [
          "基础模型",
          "商业洞察",
          "Meta"
        ],
        "report_url": "data/2026/07/2026-07-08.json"
      },
      {
        "id": "article-ac4ae95d73434499",
        "title": "Google Keyword更新公开产品或工程信息",
        "url": "https://blog.google/innovation-and-ai/models-and-research/google-research/firesat-satellites/",
        "summary": "Google Keyword更新公开产品或工程信息，重点包括标题、适用场景、访问条件、限制说明和后续链接，使用前提是读者还要查看原文中的访问条件、地区范围、价格和使用限制。 可观察的是产品入口、目标用户、上线范围和采购节奏",
        "event_date": "2026-07-07",
        "source": "Google Keyword Blog",
        "label": "本期主线",
        "tags": [
          "实战方法",
          "AI 工程栈",
          "Google"
        ],
        "report_url": "data/2026/07/2026-07-08.json"
      },
      {
        "id": "article-1ec294ada9f40d0a",
        "title": "Microsoft说明模型权重和使用说明",
        "url": "https://huggingface.co/blog/microsoft/foundry-managed-compute",
        "summary": "微软研究院说明模型能力和评估方法更新，重点包括能力边界、评估设置、数据来源、使用场景和限制说明，使用前提是结论仍要依赖可复现评测、真实任务和公开限制。 可观察的是代码、权重、示例、许可证和生态复用条件",
        "event_date": "2026-07-07",
        "source": "Microsoft Hugging Face Organization",
        "label": "本期主线",
        "tags": [